{
  "source": {
    "site": "musicbrainz",
    "collected_at": "2025-10-07T07:30:18Z"
  },
  "identifiers": {
    "catalog_number": "KSLA-0067",
    "catalog_numbers": [
      "KSLA-0067"
    ],
    "catalog_number_compact": "KSLA-0067",
    "barcode": "4933032006527",
    "mbids": {
      "release": "4a150d50-5dd6-4cdd-bd54-990d76a75f58",
      "release_group": "0752cf3c-bd11-45c8-b846-8c7277d61859",
      "label": "4356d860-9545-4e3f-b84e-71c496ea7ea3"
    }
  },
  "title": {
    "product_name": "Philosophyz",
    "edition_name": null
  },
  "artist_credit": [
    "水谷瑠奈"
  ],
  "artist_display": "水谷瑠奈",
  "label": "Key Sounds Label",
  "date": "2011-01-28",
  "country": null,
  "format": "CD",
  "tracks": [
    {
      "disc": 1,
      "no": 1,
      "title": "Philosophyz",
      "length": "4:51",
      "length_ms": 291773
    },
    {
      "disc": 1,
      "no": 2,
      "title": "闇の彼方へ",
      "length": "5:14",
      "length_ms": 314546
    },
    {
      "disc": 1,
      "no": 3,
      "title": "Philosophyz Game size Ver.",
      "length": "2:57",
      "length_ms": 177533
    },
    {
      "disc": 1,
      "no": 4,
      "title": "闇の彼方へ Game size Ver.",
      "length": "3:26",
      "length_ms": 206960
    },
    {
      "disc": 1,
      "no": 5,
      "title": "Philosophyz off vocal Ver.",
      "length": "4:51",
      "length_ms": 291546
    },
    {
      "disc": 1,
      "no": 6,
      "title": "闇の彼方へ off vocal Ver.",
      "length": "5:14",
      "length_ms": 314546
    }
  ],
  "images": {
    "cover": {
      "id": 33089081134,
      "is_front": true,
      "mime": "image/jpeg",
      "bytes": null,
      "urls": {
        "full": "https://coverartarchive.org/release/4a150d50-5dd6-4cdd-bd54-990d76a75f58/33089081134.jpg",
        "thumb_250": "https://coverartarchive.org/release/4a150d50-5dd6-4cdd-bd54-990d76a75f58/33089081134-250.jpg",
        "thumb_500": "https://coverartarchive.org/release/4a150d50-5dd6-4cdd-bd54-990d76a75f58/33089081134-500.jpg",
        "thumb_1200": "https://coverartarchive.org/release/4a150d50-5dd6-4cdd-bd54-990d76a75f58/33089081134-1200.jpg"
      }
    }
  }
}